{
  "schema": "level_intent.v1",
  "mapId": "ashwood-forest",
  "width": 150,
  "height": 100,
  "baseTerrain": "forest",
  "regions": [
    {
      "id": "dense-woods",
      "terrain": "forest",
      "shape": { "type": "rect", "x": 1, "y": 1, "w": 99, "h": 65 },
      "priority": 1,
      "style": "overgrown"
    },
    {
      "id": "clearings",
      "terrain": "grass",
      "shape": {
        "type": "polygon",
        "vertices": [[0.5, 0.02], [0.99, 0.02], [0.99, 0.5], [0.5, 0.5]]
      },
      "priority": 2,
      "style": "organic"
    }
  ],
  "paths": [
    {
      "id": "path-village-to-clearings",
      "terrain": "stone_path",
      "from": { "x": 0, "y": 50 },
      "to": { "x": 112, "y": 26 },
      "width": 4,
      "widthConstraints": { "min": 3, "max": 6 },
      "connectivity": "open"
    }
  ],
  "adjacencyRules": [
    {
      "fromTerrain": "forest",
      "toTerrain": "grass",
      "buffer": "dirt",
      "bufferWidth": 2
    },
    {
      "fromTerrain": "stone_path",
      "toTerrain": "water",
      "allowed": false
    }
  ],
  "constraints": {
    "walkableMinPct": 0.6,
    "requirePathConnectivity": true
  },
  "meta": {
    "coordSystem": "top-left",
    "tileSize": 16,
    "author": "director",
    "seed": 42,
    "extensions": {
      "director": {
        "source_zone": "ashwood-forest",
        "generated_by": "intent-v2"
      }
    }
  }
}
